"transition-colors href","hidden","md:hidden","hidden 2","md:inline","group-hover:text-muted-foreground","text-inherit","text-inherit href","hidden 3","flex 2","flex 3","hidden 4","flex 4","group-hover:text-muted-foreground 2"
"https://openrouter.ai/nvidia/nemotron-3-super-120b-a12b:free","NVIDIA: Nemotron 3 Super (free)","Nemotron 3 Super (free)","Free variant","572B tokens","NVIDIA Nemotron 3 Super is a 120B-parameter open hybrid MoE model, activating just 12B parameters for maximum compute efficiency and accuracy in complex multi-agent applications. Built on a hybrid Mamba-Transformer Mixture-of-Experts architecture with multi-token prediction (MTP), it delivers over 50% higher token generation compared to leading open models.   The model features a 1M token context window for long-term agent coherence, cross-document reasoning, and multi-step task planning. Latent MoE enables calling 4 experts for the inference cost of only one, improving intelligence and generalization. Multi-environment RL training across 10+ environments delivers leading accuracy on benchmarks including AIME 2025, TerminalBench, and SWE-Bench Verified.   Fully open with weights, datasets, and recipes under the NVIDIA Open License, Nemotron 3 Super allows easy customization and secure deployment anywhere — from workstation to cloud.","nvidia","https://openrouter.ai/nvidia","Mar 11, 2026","262K context","$0/M input","tokens","$0/M output",""
"https://openrouter.ai/nvidia/nemotron-3-nano-30b-a3b:free","NVIDIA: Nemotron 3 Nano 30B A3B (free)","Nemotron 3 Nano 30B A3B (free)","Free variant","41.2B tokens","NVIDIA Nemotron 3 Nano 30B A3B is a small language MoE model with highest compute efficiency and accuracy for developers to build specialized agentic AI systems.  The model is fully open with open-weights, datasets and recipes so developers can easily customize, optimize, and deploy the model on their infrastructure for maximum privacy and security.","nvidia","https://openrouter.ai/nvidia","Dec 14, 2025","256K context","$0/M input","tokens","$0/M output",""
"https://openrouter.ai/minimax/minimax-m2.5:free","MiniMax: MiniMax M2.5 (free)","MiniMax M2.5 (free)","Free variant","33.5B tokens","MiniMax-M2.5 is a SOTA large language model designed for real-world productivity. Trained in a diverse range of complex real-world digital working environments, M2.5 builds upon the coding expertise of M2.1 to extend into general office work, reaching fluency in generating and operating Word, Excel, and Powerpoint files, context switching between diverse software environments, and working across different agent and human teams. Scoring 80.2% on SWE-Bench Verified, 51.3% on Multi-SWE-Bench, and 76.3% on BrowseComp, M2.5 is also more token efficient than previous generations, having been trained to optimize its actions and output through planning.","minimax","https://openrouter.ai/minimax","Feb 12, 2026","197K context","$0/M input","tokens","$0/M output",""
"https://openrouter.ai/openai/gpt-oss-120b:free","OpenAI: gpt-oss-120b (free)","gpt-oss-120b (free)","Free variant","24.8B tokens","gpt-oss-120b is an open-weight, 117B-parameter Mixture-of-Experts (MoE) language model from OpenAI designed for high-reasoning, agentic, and general-purpose production use cases. It activates 5.1B parameters per forward pass and is optimized to run on a single H100 GPU with native MXFP4 quantization. The model supports configurable reasoning depth, full chain-of-thought access, and native tool use, including function calling, browsing, and structured output generation.","openai","https://openrouter.ai/openai","Aug 5, 2025","131K context","$0/M input","tokens","$0/M output",""
"https://openrouter.ai/nvidia/nemotron-nano-12b-v2-vl:free","NVIDIA: Nemotron Nano 12B 2 VL (free)","Nemotron Nano 12B 2 VL (free)","Free variant","15.2B tokens","NVIDIA Nemotron Nano 2 VL is a 12-billion-parameter open multimodal reasoning model designed for video understanding and document intelligence. It introduces a hybrid Transformer-Mamba architecture, combining transformer-level accuracy with Mamba’s memory-efficient sequence modeling for significantly higher throughput and lower latency.  The model supports inputs of text and multi-image documents, producing natural-language outputs. It is trained on high-quality NVIDIA-curated synthetic datasets optimized for optical-character recognition, chart reasoning, and multimodal comprehension.  Nemotron Nano 2 VL achieves leading results on OCRBench v2 and scores ≈ 74 average across MMMU, MathVista, AI2D, OCRBench, OCR-Reasoning, ChartQA, DocVQA, and Video-MME—surpassing prior open VL baselines. With Efficient Video Sampling (EVS), it handles long-form videos while reducing inference cost.  Open-weights, training data, and fine-tuning recipes are released under a permissive NVIDIA open license, with deployment supported across NeMo, NIM, and major inference runtimes.","nvidia","https://openrouter.ai/nvidia","Oct 28, 2025","128K context","$0/M input","tokens","$0/M output",""
"https://openrouter.ai/nvidia/nemotron-nano-9b-v2:free","NVIDIA: Nemotron Nano 9B V2 (free)","Nemotron Nano 9B V2 (free)","Free variant","12.6B tokens","NVIDIA-Nemotron-Nano-9B-v2 is a large language model (LLM) trained from scratch by NVIDIA, and designed as a unified model for both reasoning and non-reasoning tasks. It responds to user queries and tasks by first generating a reasoning trace and then concluding with a final response.   The model's reasoning capabilities can be controlled via a system prompt. If the user prefers the model to provide its final answer without intermediate reasoning traces, it can be configured to do so.","nvidia","https://openrouter.ai/nvidia","Sep 5, 2025","128K context","$0/M input","tokens","$0/M output",""
"https://openrouter.ai/nvidia/llama-nemotron-embed-vl-1b-v2:free","NVIDIA: Llama Nemotron Embed VL 1B V2 (free)","Llama Nemotron Embed VL 1B V2 (free)","Free variant","7.82B tokens","The Llama Nemotron Embed VL 1B V2 embedding model is optimized for multimodal question-answering retrieval. The model can embed 'documents' in the form of image, text, or image and text combined. Documents can be retrieved given a user query in text form. The model supports images containing text, tables, charts, and infographics.","nvidia","https://openrouter.ai/nvidia","Feb 25, 2026","131K context","$0/M input","tokens","$0/M output",""
"https://openrouter.ai/google/gemma-4-31b-it:free","Google: Gemma 4 31B (free)","Gemma 4 31B (free)","Free variant","2.56B tokens","Gemma 4 31B Instruct is Google DeepMind's 30.7B dense multimodal model supporting text and image input with text output. Features a 256K token context window, configurable thinking/reasoning mode, native function calling, and multilingual support across 140+ languages. Strong on coding, reasoning, and document understanding tasks. Apache 2.0 license.","google","https://openrouter.ai/google","Apr 2, 2026","262K context","$0/M input","tokens","$0/M output",""
"https://openrouter.ai/qwen/qwen3-coder:free","Qwen: Qwen3 Coder 480B A35B (free)","Qwen3 Coder 480B A35B (free)","Free variant","1.48B tokens","Qwen3-Coder-480B-A35B-Instruct is a Mixture-of-Experts (MoE) code generation model developed by the Qwen team. It is optimized for agentic coding tasks such as function calling, tool use, and long-context reasoning over repositories. The model features 480 billion total parameters, with 35 billion active per forward pass (8 out of 160 experts).  Pricing for the Alibaba endpoints varies by context length. Once a request is greater than 128k input tokens, the higher pricing is used.","qwen","https://openrouter.ai/qwen","Jul 23, 2025","262K context","$0/M input","tokens","$0/M output",""
"https://openrouter.ai/google/gemma-4-26b-a4b-it:free","Google: Gemma 4 26B A4B  (free)","Gemma 4 26B A4B  (free)","Free variant","1.42B tokens","Gemma 4 26B A4B IT is an instruction-tuned Mixture-of-Experts (MoE) model from Google DeepMind. Despite 25.2B total parameters, only 3.8B activate per token during inference — delivering near-31B quality at a fraction of the compute cost. Supports multimodal input including text, images, and video (up to 60s at 1fps). Features a 256K token context window, native function calling, configurable thinking/reasoning mode, and structured output support. Released under Apache 2.0.","google","https://openrouter.ai/google","Apr 3, 2026","262K context","$0/M input","tokens","$0/M output",""
"https://openrouter.ai/meta-llama/llama-3.3-70b-instruct:free","Meta: Llama 3.3 70B Instruct (free)","Llama 3.3 70B Instruct (free)","Free variant","976M tokens","The Meta Llama 3.3 multilingual large language model (LLM) is a pretrained and instruction tuned generative model in 70B (text in/text out). The Llama 3.3 instruction tuned text only model is optimized for multilingual dialogue use cases and outperforms many of the available open source and closed chat models on common industry benchmarks.  Supported languages: English, German, French, Italian, Portuguese, Hindi, Spanish, and Thai.","meta-llama","https://openrouter.ai/meta-llama","Dec 6, 2024","66K context","$0/M input","tokens","$0/M output","Model Card"
"https://openrouter.ai/qwen/qwen3-next-80b-a3b-instruct:free","Qwen: Qwen3 Next 80B A3B Instruct (free)","Qwen3 Next 80B A3B Instruct (free)","Free variant","933M tokens","Qwen3-Next-80B-A3B-Instruct is an instruction-tuned chat model in the Qwen3-Next series optimized for fast, stable responses without “thinking” traces. It targets complex tasks across reasoning, code generation, knowledge QA, and multilingual use, while remaining robust on alignment and formatting. Compared with prior Qwen3 instruct variants, it focuses on higher throughput and stability on ultra-long inputs and multi-turn dialogues, making it well-suited for RAG, tool use, and agentic workflows that require consistent final answers rather than visible chain-of-thought.  The model employs scaling-efficient training and decoding to improve parameter efficiency and inference speed, and has been validated on a broad set of public benchmarks where it reaches or approaches larger Qwen3 systems in several categories while outperforming earlier mid-sized baselines. It is best used as a general assistant, code helper, and long-context task solver in production settings where deterministic, instruction-following outputs are preferred.","qwen","https://openrouter.ai/qwen","Sep 11, 2025","262K context","$0/M input","tokens","$0/M output",""
"https://openrouter.ai/liquid/lfm-2.5-1.2b-thinking:free","LiquidAI: LFM2.5-1.2B-Thinking (free)","LFM2.5-1.2B-Thinking (free)","Free variant","663M tokens","LFM2.5-1.2B-Thinking is a lightweight reasoning-focused model optimized for agentic tasks, data extraction, and RAG—while still running comfortably on edge devices. It supports long context (up to 32K tokens) and is designed to provide higher-quality “thinking” responses in a small 1.2B model.","liquid","https://openrouter.ai/liquid","Jan 20, 2026","33K context","$0/M input","tokens","$0/M output",""
"https://openrouter.ai/bytedance-seed/seedream-4.5","ByteDance Seed: Seedream 4.5","Seedream 4.5","","549M tokens","Seedream 4.5 is the latest in-house image generation model developed by ByteDance. Compared with Seedream 4.0, it delivers comprehensive improvements, especially in editing consistency, including better preservation of subject details, lighting, and color tone. It also enhances portrait refinement and small-text rendering. The model’s multi-image composition capabilities have been significantly strengthened, and both reasoning performance and visual aesthetics continue to advance, enabling more accurate and artistically expressive image generation.  Pricing is $0.04 per output image, regardless of size.","bytedance-seed","https://openrouter.ai/bytedance-seed","Dec 23, 2025","4K context","$0.04 per image","","",""
"https://openrouter.ai/liquid/lfm-2.5-1.2b-instruct:free","LiquidAI: LFM2.5-1.2B-Instruct (free)","LFM2.5-1.2B-Instruct (free)","Free variant","484M tokens","LFM2.5-1.2B-Instruct is a compact, high-performance instruction-tuned model built for fast on-device AI. It delivers strong chat quality in a 1.2B parameter footprint, with efficient edge inference and broad runtime support.","liquid","https://openrouter.ai/liquid","Jan 20, 2026","33K context","$0/M input","tokens","$0/M output",""
"https://openrouter.ai/cognitivecomputations/dolphin-mistral-24b-venice-edition:free","Venice: Uncensored (free)","Uncensored (free)","Free variant","127M tokens","Venice Uncensored Dolphin Mistral 24B Venice Edition is a fine-tuned variant of Mistral-Small-24B-Instruct-2501, developed by dphn.ai in collaboration with Venice.ai. This model is designed as an “uncensored” instruct-tuned LLM, preserving user control over alignment, system prompts, and behavior. Intended for advanced and unrestricted use cases, Venice Uncensored emphasizes steerability and transparent behavior, removing default safety and alignment layers typically found in mainstream assistant models.","venice","https://openrouter.ai/venice","Jul 9, 2025","33K context","$0/M input","tokens","$0/M output",""
"https://openrouter.ai/google/gemma-3-27b-it:free","Google: Gemma 3 27B (free)","Gemma 3 27B (free)","Free variant","124M tokens","Gemma 3 introduces multimodality, supporting vision-language input and text outputs. It handles context windows up to 128k tokens, understands over 140 languages, and offers improved math, reasoning, and chat capabilities, including structured outputs and function calling. Gemma 3 27B is Google's latest open source model, successor to","google","https://openrouter.ai/google","Mar 12, 2025","131K context","$0/M input","tokens","$0/M output","Gemma 2"
"https://openrouter.ai/nousresearch/hermes-3-llama-3.1-405b:free","Nous: Hermes 3 405B Instruct (free)","Hermes 3 405B Instruct (free)","Free variant","101M tokens","Hermes 3 is a generalist language model with many improvements over Hermes 2, including advanced agentic capabilities, much better roleplaying, reasoning, multi-turn conversation, long context coherence, and improvements across the board.  Hermes 3 405B is a frontier-level, full-parameter finetune of the Llama-3.1 405B foundation model, focused on aligning LLMs to the user, with powerful steering capabilities and control given to the end user.  The Hermes 3 series builds and expands on the Hermes 2 set of capabilities, including more powerful and reliable function calling and structured output capabilities, generalist assistant capabilities, and improved code generation skills.  Hermes 3 is competitive, if not superior, to Llama-3.1 Instruct models at general capabilities, with varying strengths and weaknesses attributable between the two.","nousresearch","https://openrouter.ai/nousresearch","Aug 16, 2024","131K context","$0/M input","tokens","$0/M output",""
"https://openrouter.ai/meta-llama/llama-3.2-3b-instruct:free","Meta: Llama 3.2 3B Instruct (free)","Llama 3.2 3B Instruct (free)","Free variant","95.1M tokens","Llama 3.2 3B is a 3-billion-parameter multilingual large language model, optimized for advanced natural language processing tasks like dialogue generation, reasoning, and summarization. Designed with the latest transformer architecture, it supports eight languages, including English, Spanish, and Hindi, and is adaptable for additional languages.  Trained on 9 trillion tokens, the Llama 3.2 3B model excels in instruction-following, complex reasoning, and tool use. Its balanced performance makes it ideal for applications needing accuracy and efficiency in text generation across multilingual settings.  Click here for the .  Usage of this model is subject to .","meta-llama","https://openrouter.ai/meta-llama","Sep 25, 2024","131K context","$0/M input","tokens","$0/M output","original model card"
"https://openrouter.ai/google/lyria-3-pro-preview","Google: Lyria 3 Pro Preview","Lyria 3 Pro Preview","","94.1M tokens","Full-length songs are priced at $0.08 per song. Lyria 3 is Google's family of music generation models, available through the Gemini API. With Lyria 3, you can generate high-quality, 48kHz stereo audio from text prompts or from images. These models deliver structural coherence, including vocals, timed lyrics, and full instrumental arrangements. Lyria 3 Pro can generate full-length songs with verses, choruses, bridges.","google","https://openrouter.ai/google","Mar 30, 2026","1.05M context","$0.08 per song","","",""
"https://openrouter.ai/google/lyria-3-clip-preview","Google: Lyria 3 Clip Preview","Lyria 3 Clip Preview","","59M tokens","30 second duration clips are priced at $0.04 per clip. Lyria 3 is Google's family of music generation models, available through the Gemini API. With Lyria 3, you can generate high-quality, 48kHz stereo audio from text prompts or from images. These models deliver structural coherence, including vocals, timed lyrics, and full instrumental arrangements. Lyria 3 Clip can generate short clips, loops, previews.","google","https://openrouter.ai/google","Mar 30, 2026","1.05M context","$0.04 per song","","",""
"https://openrouter.ai/google/gemma-3n-e4b-it:free","Google: Gemma 3n 4B (free)","Gemma 3n 4B (free)","Free variant","51.2M tokens","Gemma 3n E4B-it is optimized for efficient execution on mobile and low-resource devices, such as phones, laptops, and tablets. It supports multimodal inputs—including text, visual data, and audio—enabling diverse tasks such as text generation, speech recognition, translation, and image analysis. Leveraging innovations like Per-Layer Embedding (PLE) caching and the MatFormer architecture, Gemma 3n dynamically manages memory usage and computational load by selectively activating model parameters, significantly reducing runtime resource requirements.  This model supports a wide linguistic range (trained in over 140 languages) and features a flexible 32K token context window. Gemma 3n can selectively load parameters, optimizing memory and computational efficiency based on the task or device capabilities, making it well-suited for privacy-focused, offline-capable applications and on-device AI solutions.","google","https://openrouter.ai/google","May 20, 2025","8K context","$0/M input","tokens","$0/M output","Read more in the blog post"
"https://openrouter.ai/google/gemma-3n-e2b-it:free","Google: Gemma 3n 2B (free)","Gemma 3n 2B (free)","Free variant","42.8M tokens","Gemma 3n E2B IT is a multimodal, instruction-tuned model developed by Google DeepMind, designed to operate efficiently at an effective parameter size of 2B while leveraging a 6B architecture. Based on the MatFormer architecture, it supports nested submodels and modular composition via the Mix-and-Match framework. Gemma 3n models are optimized for low-resource deployment, offering 32K context length and strong multilingual and reasoning performance across common benchmarks. This variant is trained on a diverse corpus including code, math, web, and multimodal data.","google","https://openrouter.ai/google","Jul 9, 2025","8K context","$0/M input","tokens","$0/M output",""
"https://openrouter.ai/google/gemma-3-12b-it:free","Google: Gemma 3 12B (free)","Gemma 3 12B (free)","Free variant","40.3M tokens","Gemma 3 introduces multimodality, supporting vision-language input and text outputs. It handles context windows up to 128k tokens, understands over 140 languages, and offers improved math, reasoning, and chat capabilities, including structured outputs and function calling. Gemma 3 12B is the second largest in the family of Gemma 3 models after","google","https://openrouter.ai/google","Mar 13, 2025","33K context","$0/M input","tokens","$0/M output","Gemma 3 27B"
"https://openrouter.ai/sourceful/riverflow-v2-fast-preview","Sourceful: Riverflow V2 Fast Preview","Riverflow V2 Fast Preview","","18.3M tokens","Riverflow V2 Fast Preview is the fastest variant of Sourceful's Riverflow V2 preview lineup. This preview version exceeds the performance of Riverflow 1 Family and is Sourceful's first unified text-to-image and image-to-image model family.  Pricing is $0.03 per output image, regardless of size.  Sourceful imposes a 4.5MB request size limit, therefore it is highly recommended to pass image URLs instead of Base64 data.","sourceful","https://openrouter.ai/sourceful","Dec 9, 2025","8K context","$0.03 per image","","",""
"https://openrouter.ai/sourceful/riverflow-v2-max-preview","Sourceful: Riverflow V2 Max Preview","Riverflow V2 Max Preview","","11M tokens","Riverflow V2 Max Preview is the most powerful variant of Sourceful's Riverflow V2 preview lineup. This preview version exceeds the performance of Riverflow 1 Family and is Sourceful's first unified text-to-image and image-to-image model family.  Pricing is $0.075 per output image, regardless of size.  Sourceful imposes a 4.5MB request size limit, therefore it is highly recommended to pass image URLs instead of Base64 data.","sourceful","https://openrouter.ai/sourceful","Dec 9, 2025","8K context","$0.075 per image","","",""
"https://openrouter.ai/sourceful/riverflow-v2-standard-preview","Sourceful: Riverflow V2 Standard Preview","Riverflow V2 Standard Preview","","8.4M tokens","Riverflow V2 Standard Preview is the standard variant of Sourceful's Riverflow V2 preview lineup. This preview version exceeds the performance of Riverflow 1 Family and is Sourceful's first unified text-to-image and image-to-image model family.  Pricing is $0.035 per output image, regardless of size.  Sourceful imposes a 4.5MB request size limit, therefore it is highly recommended to pass image URLs instead of Base64 data.","sourceful","https://openrouter.ai/sourceful","Dec 9, 2025","8K context","$0.035 per image","","",""
"https://openrouter.ai/cohere/rerank-4-pro","Cohere: Rerank 4 Pro","Rerank 4 Pro","","","Cohere's AI search foundation model for enhancing the relevance of information surfaced within search and RAG systems. Features a 32K context window, multilingual support across 100+ languages, no data pre-processing required, and state of the art performance with low latency.","cohere","https://openrouter.ai/cohere","Apr 6, 2026","33K context","$0.0025 per search","","",""
"https://openrouter.ai/cohere/rerank-4-fast","Cohere: Rerank 4 Fast","Rerank 4 Fast","","","Cohere's AI search foundation model for enhancing the relevance of information surfaced within search and RAG systems. Features a 32K context window, multilingual support across 100+ languages, no data pre-processing required, and high performance with lowest latency.","cohere","https://openrouter.ai/cohere","Apr 6, 2026","33K context","$0.002 per search","","",""
"https://openrouter.ai/cohere/rerank-v3.5","Cohere: Rerank v3.5","Rerank v3.5","","","Rerank v3.5 is designed to reorder search results for improved relevance. It supports multi-aspect and semi-structured data reranking over 100+ languages. Ideal for refining results from semantic or keyword search pipelines.","cohere","https://openrouter.ai/cohere","Apr 5, 2026","4K context","$0.001 per search","","",""
"https://openrouter.ai/alibaba/wan-2.6","Alibaba: Wan 2.6 (experimental)","Wan 2.6 (experimental)","","","Video generation is API-only and currently in alpha. If you’re interested in trying it, please read about the capabilities and limitations here:","alibaba","https://openrouter.ai/alibaba","Mar 28, 2026","","","","","https://openrouter.notion.site/video-generation-testing"
"https://openrouter.ai/bytedance/seedance-1-5-pro","ByteDance: Seedance 1.5 Pro (experimental)","Seedance 1.5 Pro (experimental)","","","Video generation is API-only and currently in alpha. If you’re interested in trying it, please read about the capabilities and limitations here:","bytedance","https://openrouter.ai/bytedance","Mar 23, 2026","","","","","https://openrouter.notion.site/video-generation-testing"
"https://openrouter.ai/openai/sora-2-pro","OpenAI: Sora 2 Pro (experimental)","Sora 2 Pro (experimental)","","","Video generation is API-only and currently in alpha. If you’re interested in trying it, please read about the capabilities and limitations here:","openai","https://openrouter.ai/openai","Mar 23, 2026","","","","","https://openrouter.notion.site/video-generation-testing"
"https://openrouter.ai/google/veo-3.1","Google: Veo 3.1 (experimental)","Veo 3.1 (experimental)","","","Video generation is API-only and currently in alpha. If you’re interested in trying it, please read about the capabilities and limitations here:","google","https://openrouter.ai/google","Mar 23, 2026","","","","","https://openrouter.notion.site/video-generation-testing"
"https://openrouter.ai/black-forest-labs/flux.2-klein-4b","Black Forest Labs: FLUX.2 Klein 4B","FLUX.2 Klein 4B","","","FLUX.2 [klein] 4B is the fastest and most cost-effective model in the FLUX.2 family, optimized for high-throughput use cases while maintaining excellent image quality.  Pricing is based on the output image. The first generated megapixel is charged $0.014. Each subsequent megapixel is charged $0.001.","black-forest-labs","https://openrouter.ai/black-forest-labs","Jan 14, 2026","41K context","$0.014 per megapixel","","",""
"https://openrouter.ai/black-forest-labs/flux.2-max","Black Forest Labs: FLUX.2 Max","FLUX.2 Max","","","FLUX.2 [max] is the new top-tier image model from Black Forest Labs, pushing image quality, prompt understanding, and editing consistency to the highest level yet.  Pricing is as follows, : Input: We charge $0.03 for each megapixel on the input (i.e. reference images for editing) Output: The first generated megapixel is charged $0.07. Each subsequent megapixel is charged $0.03.","black-forest-labs","https://openrouter.ai/black-forest-labs","Dec 16, 2025","47K context","$0.07 per megapixel","","","per the docs"
